{
  "$schema": "./package.schema.json",
  "id": "internal",
  "version": "1.0.0",
  "metadata": {
    "name": "Internal",
    "description": "Built-in nodes and runners for local development",
    "tags": ["internal", "builtin", "development"],
    "author": "Snipet AI",
    "docs": "https://docs.snipet.ai/internal"
  },
  "nodeTypes": [
    {
      "id": "internal:node-type:log",
      "metadata": {
        "name": "Log",
        "description": "Log a message to the console"
      },
      "inputs": [
        {
          "name": "message",
          "type": "string",
          "description": "The message to log",
          "required": true
        }
      ],
      "outputs": [
        {
          "name": "message",
          "type": "string",
          "description": "The message logged"
        }
      ]
    },
    {
      "id": "internal:node-type:sleep",
      "metadata": {
        "name": "Sleep",
        "description": "Sleep for a given number of milliseconds"
      },
      "inputs": [
        {
          "name": "milliseconds",
          "type": "number",
          "description": "The number of milliseconds to sleep",
          "required": true
        }
      ],
      "outputs": [
        {
          "name": "void",
          "type": "void",
          "description": "A void output"
        }
      ]
    },
    {
      "id": "internal:node-type:storage",
      "metadata": {
        "name": "Storage",
        "description": "Store data in a storage"
      },
      "inputs": [
        {
          "name": "files",
          "type": "files",
          "description": "The files to store",
          "required": true
        },
        {
          "name": "path",
          "type": "string",
          "description": "The path to store the files",
          "required": true
        }
      ],
      "outputs": [
        {
          "name": "void",
          "type": "void",
          "description": "A void output"
        }
      ]
    }
  ],
  "configs": [
    {
      "id": "internal:config:storage",
      "metadata": {
        "name": "Storage",
        "description": "Storage configuration"
      },
      "fields": [
        {
          "name": "basePath",
          "type": "string",
          "description": "The base path to store the files",
          "required": true
        }
      ]
    }
  ],
  "nodes": [
    {
      "id": "internal:node:log",
      "type": "internal:node-type:log",
      "metadata": {
        "name": "Log",
        "description": "Log a message to the console",
        "tags": ["log", "console", "development"],
        "icon": "<svg xmlns='http://www.w3.org/2000/svg' width='24' height='24' viewBox='0 0 24 24' fill='none' stroke='currentColor' stroke-width='2' stroke-linecap='round' stroke-linejoin='round' class='lucide lucide-bug-icon lucide-bug'><path d='M12 20v-9'/><path d='M14 7a4 4 0 0 1 4 4v3a6 6 0 0 1-12 0v-3a4 4 0 0 1 4-4z'/><path d='M14.12 3.88 16 2'/><path d='M21 21a4 4 0 0 0-3.81-4'/><path d='M21 5a4 4 0 0 1-3.55 3.97'/><path d='M22 13h-4'/><path d='M3 21a4 4 0 0 1 3.81-4'/><path d='M3 5a4 4 0 0 0 3.55 3.97'/><path d='M6 13H2'/><path d='m8 2 1.88 1.88'/><path d='M9 7.13V6a3 3 0 1 1 6 0v1.13'/></svg>"
      }
    },
    {
      "id": "internal:node:sleep",
      "type": "internal:node-type:sleep",
      "metadata": {
        "name": "Sleep",
        "description": "Sleep for a given number of milliseconds",
        "tags": ["sleep", "development"],
        "icon": "<svg xmlns='http://www.w3.org/2000/svg' width='24' height='24' viewBox='0 0 24 24' fill='none' stroke='currentColor' stroke-width='2' stroke-linecap='round' stroke-linejoin='round' class='lucide lucide-loader-icon lucide-loader'><path d='M12 2v4'/><path d='m16.2 7.8 2.9-2.9'/><path d='M18 12h4'/><path d='m16.2 16.2 2.9 2.9'/><path d='M12 18v4'/><path d='m4.9 19.1 2.9-2.9'/><path d='M2 12h4'/><path d='m4.9 4.9 2.9 2.9'/></svg>"
      }
    },
    {
      "id": "internal:node:file-system",
      "type": "internal:node-type:storage",
      "config": "internal:config:storage",
      "metadata": {
        "name": "FileSystem Storage",
        "description": "Store data in the file system",
        "tags": ["storage", "file-system", "development"],
        "icon": "<svg xmlns='http://www.w3.org/2000/svg' width='24' height='24' viewBox='0 0 24 24' fill='none' stroke='currentColor' stroke-width='2' stroke-linecap='round' stroke-linejoin='round' class='lucide lucide-hard-drive-icon lucide-hard-drive'><path d='M10 16h.01'/><path d='M2.212 11.577a2 2 0 0 0-.212.896V18a2 2 0 0 0 2 2h16a2 2 0 0 0 2-2v-5.527a2 2 0 0 0-.212-.896L18.55 5.11A2 2 0 0 0 16.76 4H7.24a2 2 0 0 0-1.79 1.11z'/><path d='M21.946 12.013H2.054'/><path d='M6 16h.01'/></svg>"
      }
    }
  ]
}